Text,Law Name,Law Description
Consent prevents access to service,"Freely Given (R43, A4-11)","If the data subject’s consent is given in the context of a written declaration which also concerns other matters, the request for consent shall be presented in a manner which is clearly distinguishable from the other matters, in an intelligible and easily accessible form, using clear and plain language. Any part of such a declaration which constitutes an infringement of this Regulation shall not be binding."
Consent or payment as options,"Freely Given (R43, A4-11)","n order to ensure that consent is freely given, consent should not provide a valid legal ground for the processing of personal data in a specific case where there is a clear imbalance between the data subject and the controller, in particular where the controller is a public authority and it is therefore unlikely that consent was freely given in all the circumstances of that specific situation. 2Consent is presumed not to be freely given if it does not allow separate consent to be given to different personal data processing operations despite it being appropriate in the individual case, or if the performance of a contract, including the provision of a service, is dependent on the consent despite such consent not being necessary for such performance."
Purposes are not explicit or specific enough,"Specific (A4-11, A7-2)","consent' of the data subject means any freely given, specific, informed and unambiguous indication of the data subject's wishes by a statement or by a clear affirmative action, signifies agreement to the processing of personal data relating to him or her."
Information is missing,"Information Provision (A13, A14)","When assessing whether consent is freely given, utmost account shall be taken of whether, inter alia, the performance of a contract, including the provision of a service, is conditional on consent to the processing of personal data that is not necessary for the performance of that contract."
Legal basis is incorrect,Legal Basis (A6),Processing shall be lawful only if and to the extent that at one of the applicable legal basis is utilised.
Legal basis should be consent,Legal Basis (A6),Processing shall be lawful only if and to the extent that the applicable legal basis of consent is utilised.
Consent should be explicit,Explicit Consent (A9),Processing utilises special categories of personal data which is prohibited from being processed unless suitable explicit consent is obtained as per A9-1a.
Consent withdrawal conditions are not met,Withdrawal (A7-3),"The data subject shall have the right to withdraw his or her consent at any time. 2The withdrawal of consent shall not affect the lawfulness of processing based on consent before its withdrawal. 3Prior to giving consent, the data subject shall be informed thereof. 4It shall be as easy to withdraw as to give consent."
